{
  "$defs": {
    "Features": {
      "additionalProperties": false,
      "properties": {
        "product_type": {
          "enum": [
            "L",
            "M",
            "H"
          ],
          "title": "Product Type",
          "type": "string"
        },
        "air_temperature_k": {
          "title": "Air Temperature K",
          "type": "number"
        },
        "process_temperature_k": {
          "title": "Process Temperature K",
          "type": "number"
        },
        "rotational_speed_rpm": {
          "exclusiveMinimum": 0,
          "title": "Rotational Speed Rpm",
          "type": "number"
        },
        "torque_nm": {
          "title": "Torque Nm",
          "type": "number"
        },
        "tool_wear_min": {
          "minimum": 0,
          "title": "Tool Wear Min",
          "type": "number"
        }
      },
      "required": [
        "product_type",
        "air_temperature_k",
        "process_temperature_k",
        "rotational_speed_rpm",
        "torque_nm",
        "tool_wear_min"
      ],
      "title": "Features",
      "type": "object"
    }
  },
  "additionalProperties": false,
  "properties": {
    "event_id": {
      "minLength": 1,
      "title": "Event Id",
      "type": "string"
    },
    "machine_id": {
      "minLength": 1,
      "title": "Machine Id",
      "type": "string"
    },
    "received_at": {
      "format": "date-time",
      "title": "Received At",
      "type": "string"
    },
    "source": {
      "const": "AI4I_SIMULATOR",
      "title": "Source",
      "type": "string"
    },
    "features": {
      "$ref": "#/$defs/Features"
    }
  },
  "required": [
    "event_id",
    "machine_id",
    "received_at",
    "source",
    "features"
  ],
  "title": "SensorEvent",
  "type": "object",
  "$schema": "https://json-schema.org/draft/2020-12/schema",
  "$id": "urn:maintai:contracts:sensor-event:1.1.0"
}
